"translation","source","can_modify"
"Lock on to get the opponent in your sights.{LF}Any of the dragon's attacks can be{LF}devastating, so try getting a handle on{LF}your foe's moves before taking action.{#Name=""Recording 0020_10: Gabriel""}","Lock on to get the opponent in your sights.{LF}Any of the dragon's attacks can be{LF}devastating, so try getting a handle on{LF}your foe's moves before taking action.{#Name=""Recording 0020_10: Gabriel""}","1"
"Dragons pack a formidable punch. Use your{LF}defensive and evasive skills to wage the{LF}battle, and above all, don't be reckless.{#Name=""Recording 0020_20: Gabriel""}","Dragons pack a formidable punch. Use your{LF}defensive and evasive skills to wage the{LF}battle, and above all, don't be reckless.{#Name=""Recording 0020_20: Gabriel""}","1"
"Dragons pack a formidable punch. Use your{LF}defensive and evasive skills to wage the{LF}battle, and above all, don't be reckless.{#Name=""Recording 0020_20: Gabriel""}","Dragons pack a formidable punch. Use your{LF}defensive and evasive skills to wage the{LF}battle, and above all, don't be reckless.{#Name=""Recording 0020_20: Gabriel""}","1"
"Why not try locking on to Phanuel once he leaves{LF}the water? Keeping a close eye on his movements{LF}will help you keep the advantage in battle.{#Name=""Recording 1040_10: Phanuel""}","Why not try locking on to Phanuel once he leaves{LF}the water? Keeping a close eye on his movements{LF}will help you keep the advantage in battle.{#Name=""Recording 1040_10: Phanuel""}","1"
"When you see the orange marker, that's your{LF}chance to attack Phanuel. Don't miss it!{#Name=""Recording 1040_20: Phanuel""}","When you see the orange marker, that's your{LF}chance to attack Phanuel. Don't miss it!{#Name=""Recording 1040_20: Phanuel""}","1"
"Fire-based attacks are generally ineffective{LF}underwater, so try dragging your foe up to land{LF}before striking. Bash him head-on before he{LF}dives beneath the water to get him out.{#Name=""Recording 1040_30: Phanuel""}","Fire-based attacks are generally ineffective{LF}underwater, so try dragging your foe up to land{LF}before striking. Bash him head-on before he{LF}dives beneath the water to get him out.{#Name=""Recording 1040_30: Phanuel""}","1"
"The energy blasts that fire out of the magic circles{LF}can be destroyed. If you find yourself getting{LF}overwhelmed, try using your multi lock-on to{LF}more efficiently take them down.{#Name=""Recording 2060_10: Armaros""}","The energy blasts that fire out of the magic circles{LF}can be destroyed. If you find yourself getting{LF}overwhelmed, try using your multi lock-on to{LF}more efficiently take them down.{#Name=""Recording 2060_10: Armaros""}","1"
"If you find yourself in trouble, try triggering{LF}Intoner Mode. Not only will you be able to deal{LF}a ton of additional damage, you'll also make{LF}yourself invincible for a short period of time.{#Name=""Recording 2060_20: Armaros""}","If you find yourself in trouble, try triggering{LF}Intoner Mode. Not only will you be able to deal{LF}a ton of additional damage, you'll also make{LF}yourself invincible for a short period of time.{#Name=""Recording 2060_20: Armaros""}","1"
"It's best to destroy those pesky cannons quickly.{LF}Try attacking them while transitioning between towers;{LF}once they're out of the picture, you can attack{LF}Armaros without any unnecessary distractions.{#Name=""Recording 2060_30: Armaros""}","It's best to destroy those pesky cannons quickly.{LF}Try attacking them while transitioning between towers;{LF}once they're out of the picture, you can attack{LF}Armaros without any unnecessary distractions.{#Name=""Recording 2060_30: Armaros""}","1"
"The pulsating core hanging beneath the fortress is{LF}its weak point. Don't be fooled by its movements;{LF}try to predict where it'll go next as you attack.{#Name=""Recording 2060_40: Armaros""}","The pulsating core hanging beneath the fortress is{LF}its weak point. Don't be fooled by its movements;{LF}try to predict where it'll go next as you attack.{#Name=""Recording 2060_40: Armaros""}","1"
"The exploding shots can be destroyed before{LF}they blow up. Use your multi lock-on to try{LF}and take them down in one fell swoop.{#Name=""Recording 2060_50: Armaros""}","The exploding shots can be destroyed before{LF}they blow up. Use your multi lock-on to try{LF}and take them down in one fell swoop.{#Name=""Recording 2060_50: Armaros""}","1"
"You can use {01}{0B} to try and evade any attacks{LF}you fail to shoot down. Be careful not to evade{LF}too much, though, or Four might be able to escape.{#Name=""Recording 2060_60: Armaros""}","You can use {01}{0B} to try and evade any attacks{LF}you fail to shoot down. Be careful not to evade{LF}too much, though, or Four might be able to escape.{#Name=""Recording 2060_60: Armaros""}","1"
"If one of Armisael's dolls clings to you,{LF}it'll eventually explode and deal damage.{LF}Use jumps, evades, and other quick{LF}maneuvers to try and shake it off.{#Name=""Recording 3060_10: Armisael""}","If one of Armisael's dolls clings to you,{LF}it'll eventually explode and deal damage.{LF}Use jumps, evades, and other quick{LF}maneuvers to try and shake it off.{#Name=""Recording 3060_10: Armisael""}","1"
"Armisael's beam attack consumes a great deal{LF}of its song power, weakening it for a period of{LF}time afterward. That's your chance to strike!{#Name=""Recording 3060_20: Armisael""}","Armisael's beam attack consumes a great deal{LF}of its song power, weakening it for a period of{LF}time afterward. That's your chance to strike!{#Name=""Recording 3060_20: Armisael""}","1"
"When you see the orange marker, that's your{LF}chance to attack Armisael. Don't miss it!{#Name=""Recording 3060_30: Armisael""}","When you see the orange marker, that's your{LF}chance to attack Armisael. Don't miss it!{#Name=""Recording 3060_30: Armisael""}","1"
"As long as the Egregori have their armor,{LF}you can't damage them. Bash into them{LF}to knock the armor off, then strike.{#Name=""Recording 4040_10: Egregori""}","As long as the Egregori have their armor,{LF}you can't damage them. Bash into them{LF}to knock the armor off, then strike.{#Name=""Recording 4040_10: Egregori""}","1"
"Removing the Egregori's armor weakens them,{LF}but also eliminates any chance to strike them{LF}with melee blows. Switch to fire instead.{#Name=""Recording 4040_20: Egregori""}","Removing the Egregori's armor weakens them,{LF}but also eliminates any chance to strike them{LF}with melee blows. Switch to fire instead.{#Name=""Recording 4040_20: Egregori""}","1"
"When you see the orange marker, that's your{LF}chance to attack the Egregori. Don't miss it!{#Name=""Recording 4040_30: Egregori""}","When you see the orange marker, that's your{LF}chance to attack the Egregori. Don't miss it!{#Name=""Recording 4040_30: Egregori""}","1"
"Gabriel's weak spot is inside his mouth.{LF}Look for the orange marker and strike{LF}fast once you see it.{#Name=""Recording 5010_10: Gabriel""}","Gabriel's weak spot is inside his mouth.{LF}Look for the orange marker and strike{LF}fast once you see it.{#Name=""Recording 5010_10: Gabriel""}","1"
"Gabriel's laser attack is dangerous, but it{LF}also provides a prime opportunity to strike.{LF}Watch for him to start charging up energy,{LF}and then seize the chance to pummel him.{#Name=""Recording 5010_20: Gabriel""}","Gabriel's laser attack is dangerous, but it{LF}also provides a prime opportunity to strike.{LF}Watch for him to start charging up energy,{LF}and then seize the chance to pummel him.{#Name=""Recording 5010_20: Gabriel""}","1"
"If necessary, you can shoot down the{LF}swords of light that Gabriel fires at you.{LF}Use your multi lock-on to target and{LF}destroy multiple swords at once.{#Name=""Recording 5010_30: Gabriel""}","If necessary, you can shoot down the{LF}swords of light that Gabriel fires at you.{LF}Use your multi lock-on to target and{LF}destroy multiple swords at once.{#Name=""Recording 5010_30: Gabriel""}","1"
"Gabriel's fireball attacks can be detonated{LF}before they're launched. The interval after a{LF}fireball explodes is your best attack chance.{LF}Use it to hit him as hard as you can!{#Name=""Recording 5040_10: Gabriel""}","Gabriel's fireball attacks can be detonated{LF}before they're launched. The interval after a{LF}fireball explodes is your best attack chance.{LF}Use it to hit him as hard as you can!{#Name=""Recording 5040_10: Gabriel""}","1"
"Gabriel's weak spot is inside his mouth.{LF}Look for the orange marker and strike{LF}fast once you see it.{#Name=""Recording 5040_20: Gabriel""}","Gabriel's weak spot is inside his mouth.{LF}Look for the orange marker and strike{LF}fast once you see it.{#Name=""Recording 5040_20: Gabriel""}","1"
"Gabriel's fireball attacks can be detonated{LF}before they're launched. The interval after a{LF}fireball explodes is your best attack chance.{LF}Use it to hit him as hard as you can!{#Name=""Recording 5040_10: Gabriel""}","Gabriel's fireball attacks can be detonated{LF}before they're launched. The interval after a{LF}fireball explodes is your best attack chance.{LF}Use it to hit him as hard as you can!{#Name=""Recording 5040_10: Gabriel""}","1"
"Don't let up on your attack. Use the chance{LF}Mikhail gave you to seize victory! The song-{LF}based barrier protecting Gabriel has also been{LF}weakened, so try to damage his injured legs.{#Name=""Recording 5040_30: Gabriel""}","Don't let up on your attack. Use the chance{LF}Mikhail gave you to seize victory! The song-{LF}based barrier protecting Gabriel has also been{LF}weakened, so try to damage his injured legs.{#Name=""Recording 5040_30: Gabriel""}","1"
"He may be wounded and weakened,{LF}but the dragon still packs a powerful punch.{LF}Don't forget your blocking and evasion skills.{#Name=""Recording 5040_40: Gabriel""}","He may be wounded and weakened,{LF}but the dragon still packs a powerful punch.{LF}Don't forget your blocking and evasion skills.{#Name=""Recording 5040_40: Gabriel""}","1"
"Gabriel's weak spot is in his mouth, so you{LF}can't hurt him if he's just standing there.{LF}You need to create a situation where you {LF}can attack the inside of his mouth.{#Name=""Recording 5040_50: Gabriel""}","Gabriel's weak spot is in his mouth, so you{LF}can't hurt him if he's just standing there.{LF}You need to create a situation where you {LF}can attack the inside of his mouth.{#Name=""Recording 5040_50: Gabriel""}","1"
"The spider's song-based protection is weakened{LF}for a moment after it emits its poison.{LF}Take this opportunity to bash into it head-on.{#Name=""Recording 3250_10: Raphael""}","The spider's song-based protection is weakened{LF}for a moment after it emits its poison.{LF}Take this opportunity to bash into it head-on.{#Name=""Recording 3250_10: Raphael""}","1"
"Don't rest easy just because your foe is down.{LF}It may counter with a web attack that could{LF}deal devastating damage.{#Name=""Recording 3250_20: Raphael""}","Don't rest easy just because your foe is down.{LF}It may counter with a web attack that could{LF}deal devastating damage.{#Name=""Recording 3250_20: Raphael""}","1"
"When you see the orange marker, that's{LF}your chance to attack. Don't miss it!{#Name=""Recording 3250_30: Raphael""}","When you see the orange marker, that's{LF}your chance to attack. Don't miss it!{#Name=""Recording 3250_30: Raphael""}","1"
"Abdiel's core is its weakness; attacking{LF}any other part is useless. Look for the{LF}golem with the core and strike!{#Name=""Recording 5120_10: Abdiel""}","Abdiel's core is its weakness; attacking{LF}any other part is useless. Look for the{LF}golem with the core and strike!{#Name=""Recording 5120_10: Abdiel""}","1"
"Attacking anything but the core is useless.{LF}Destroy Abdiel's body and expose the core{LF}hidden within to deal damage. But move fast;{LF}given enough time, it will restore itself.{#Name=""Recording 5120_20: Abdiel""}","Attacking anything but the core is useless.{LF}Destroy Abdiel's body and expose the core{LF}hidden within to deal damage. But move fast;{LF}given enough time, it will restore itself.{#Name=""Recording 5120_20: Abdiel""}","1"
"Abdiel's core is its weakness; attacking{LF}any other part is useless. Look for the{LF}golem with the core and strike!{#Name=""Recording 5120_10: Abdiel""}","Abdiel's core is its weakness; attacking{LF}any other part is useless. Look for the{LF}golem with the core and strike!{#Name=""Recording 5120_10: Abdiel""}","1"
"The golems can put up a stout defense, but they{LF}leave themselves open for a brief moment when{LF}attacking. Don't miss this chance!{#Name=""Recording 5120_30: Abdiel""}","The golems can put up a stout defense, but they{LF}leave themselves open for a brief moment when{LF}attacking. Don't miss this chance!{#Name=""Recording 5120_30: Abdiel""}","1"
"The golems can put up a stout defense, but they{LF}leave themselves open for a brief moment when{LF}attacking. Don't miss this chance!{#Name=""Recording 5120_30: Abdiel""}","The golems can put up a stout defense, but they{LF}leave themselves open for a brief moment when{LF}attacking. Don't miss this chance!{#Name=""Recording 5120_30: Abdiel""}","1"
"The golems can put up a stout defense, but they{LF}leave themselves open for a brief moment when{LF}attacking. Don't miss this chance!{#Name=""Recording 5120_30: Abdiel""}","The golems can put up a stout defense, but they{LF}leave themselves open for a brief moment when{LF}attacking. Don't miss this chance!{#Name=""Recording 5120_30: Abdiel""}","1"
"Zophiel's fireball attacks can be detonated{LF}before they're launched. The interval after a{LF}fireball explodes is your best attack chance.{LF}Use it to hit him as hard as you can!{#Name=""Recording 2320_10: Zophiel""}","Zophiel's fireball attacks can be detonated{LF}before they're launched. The interval after a{LF}fireball explodes is your best attack chance.{LF}Use it to hit him as hard as you can!{#Name=""Recording 2320_10: Zophiel""}","1"
"Zophiel's weak spot is inside his mouth.{LF}Look for the orange marker and strike{LF}fast once you see it.{#Name=""Recording 2320_20: Zophiel""}","Zophiel's weak spot is inside his mouth.{LF}Look for the orange marker and strike{LF}fast once you see it.{#Name=""Recording 2320_20: Zophiel""}","1"
"Zophiel's fireball attacks can be detonated{LF}before they're launched. The interval after a{LF}fireball explodes is your best attack chance.{LF}Use it to hit him as hard as you can!{#Name=""Recording 2320_10: Zophiel""}","Zophiel's fireball attacks can be detonated{LF}before they're launched. The interval after a{LF}fireball explodes is your best attack chance.{LF}Use it to hit him as hard as you can!{#Name=""Recording 2320_10: Zophiel""}","1"
"Five can consume Galgaliel soldiers to fully{LF}heal her wounds. As long as Galgaliel are around,{LF}defeating Five will be difficult.{#Name=""Recording 3320_10: Galgaliel""}","Five can consume Galgaliel soldiers to fully{LF}heal her wounds. As long as Galgaliel are around,{LF}defeating Five will be difficult.{#Name=""Recording 3320_10: Galgaliel""}","1"
"Five can consume Galgaliel soldiers to fully{LF}heal her wounds. As long as Galgaliel are around,{LF}defeating Five will be difficult.{#Name=""Recording 3320_10: Galgaliel""}","Five can consume Galgaliel soldiers to fully{LF}heal her wounds. As long as Galgaliel are around,{LF}defeating Five will be difficult.{#Name=""Recording 3320_10: Galgaliel""}","1"
"Five can consume Galgaliel soldiers to fully{LF}heal her wounds. As long as Galgaliel are around,{LF}defeating Five will be difficult.{#Name=""Recording 3320_10: Galgaliel""}","Five can consume Galgaliel soldiers to fully{LF}heal her wounds. As long as Galgaliel are around,{LF}defeating Five will be difficult.{#Name=""Recording 3320_10: Galgaliel""}","1"
"When attacked, Ezrael goes on the defensive and{LF}warps to safety. Take advantage of this to cut{LF}down the opportunities Ezrael has to attack.{#Name=""Recording 4320_10: Ezrael""}","When attacked, Ezrael goes on the defensive and{LF}warps to safety. Take advantage of this to cut{LF}down the opportunities Ezrael has to attack.{#Name=""Recording 4320_10: Ezrael""}","1"
"If it's too hard to dodge an attack, try drawing{LF}the enemy in, then evading. Don't evade too early,{LF}though, or you may leave yourself open to attack.{#Name=""Recording 4320_20: Ezrael""}","If it's too hard to dodge an attack, try drawing{LF}the enemy in, then evading. Don't evade too early,{LF}though, or you may leave yourself open to attack.{#Name=""Recording 4320_20: Ezrael""}","1"
"Ezrael is vulnerable for a moment right after{LF}he warps. Learn your foe's warping habits to{LF}predict where he'll go next, then attack!{#Name=""Recording 4320_30: Ezrael""}","Ezrael is vulnerable for a moment right after{LF}he warps. Learn your foe's warping habits to{LF}predict where he'll go next, then attack!{#Name=""Recording 4320_30: Ezrael""}","1"
"Ezrael is vulnerable after it finishes firing{LF}its laser. If you damage it during this time,{LF}you may briefly incapacitate it, allowing{LF}you to deal even more damage.{#Name=""Recording 4320_40: Ezrael""}","Ezrael is vulnerable after it finishes firing{LF}its laser. If you damage it during this time,{LF}you may briefly incapacitate it, allowing{LF}you to deal even more damage.{#Name=""Recording 4320_40: Ezrael""}","1"
"Stay close to the laser as you dodge, and wait{LF}for your chance to strike. If you move too far{LF}away from it, you'll miss your opportunity{LF}to attack. Don't be afraid to take risks!{#Name=""Recording 4320_50: Ezrael""}","Stay close to the laser as you dodge, and wait{LF}for your chance to strike. If you move too far{LF}away from it, you'll miss your opportunity{LF}to attack. Don't be afraid to take risks!{#Name=""Recording 4320_50: Ezrael""}","1"
"You can evade to more easily dodge Ezrael's attacks,{LF}but you'll end up with less time to devote to your own.{LF}For best results, use such maneuvers sparingly.{#Name=""Recording 4320_60: Ezrael""}","You can evade to more easily dodge Ezrael's attacks,{LF}but you'll end up with less time to devote to your own.{LF}For best results, use such maneuvers sparingly.{#Name=""Recording 4320_60: Ezrael""}","1"
"ヒントテキスト１　DLC5_040　　　一行目{LF}ヒントテキスト１　DLC5_040　　　二行目{LF}ヒントテキスト１　DLC5_040　　　三行目{LF}ヒントテキスト１　DLC5_040　　　四行目{LF}ヒントテキスト１　DLC5_040　　　五行目{#Name=""Yummy-looking Crab (1)""}","ヒントテキスト１　DLC5_040　　　一行目{LF}ヒントテキスト１　DLC5_040　　　二行目{LF}ヒントテキスト１　DLC5_040　　　三行目{LF}ヒントテキスト１　DLC5_040　　　四行目{LF}ヒントテキスト１　DLC5_040　　　五行目{#Name=""Yummy-looking Crab (1)""}","1"
"ヒントテキスト２　DLC5_040　　　一行目{LF}ヒントテキスト２　DLC5_040　　　二行目{LF}ヒントテキスト２　DLC5_040　　　三行目{LF}ヒントテキスト２　DLC5_040　　　四行目{LF}ヒントテキスト２　DLC5_040　　　五行目{#Name=""Yummy-looking Crab (2)""}","ヒントテキスト２　DLC5_040　　　一行目{LF}ヒントテキスト２　DLC5_040　　　二行目{LF}ヒントテキスト２　DLC5_040　　　三行目{LF}ヒントテキスト２　DLC5_040　　　四行目{LF}ヒントテキスト２　DLC5_040　　　五行目{#Name=""Yummy-looking Crab (2)""}","1"
"ヒントテキスト３　DLC5_040　　　一行目{LF}ヒントテキスト３　DLC5_040　　　二行目{LF}ヒントテキスト３　DLC5_040　　　三行目{LF}ヒントテキスト３　DLC5_040　　　四行目{LF}ヒントテキスト３　DLC5_040　　　五行目{#Name=""Yummy-looking Crab (3)""}","ヒントテキスト３　DLC5_040　　　一行目{LF}ヒントテキスト３　DLC5_040　　　二行目{LF}ヒントテキスト３　DLC5_040　　　三行目{LF}ヒントテキスト３　DLC5_040　　　四行目{LF}ヒントテキスト３　DLC5_040　　　五行目{#Name=""Yummy-looking Crab (3)""}","1"
"ヒントテキスト１　DLC4_040　　　一行目{LF}ヒントテキスト１　DLC4_040　　　二行目{LF}ヒントテキスト１　DLC4_040　　　三行目{LF}ヒントテキスト１　DLC4_040　　　四行目{LF}ヒントテキスト１　DLC4_040　　　五行目{#Name=""Pirate fleet (1)""}","ヒントテキスト１　DLC4_040　　　一行目{LF}ヒントテキスト１　DLC4_040　　　二行目{LF}ヒントテキスト１　DLC4_040　　　三行目{LF}ヒントテキスト１　DLC4_040　　　四行目{LF}ヒントテキスト１　DLC4_040　　　五行目{#Name=""Pirate fleet (1)""}","1"
"ヒントテキスト２　DLC4_040　　　一行目{LF}ヒントテキスト２　DLC4_040　　　二行目{LF}ヒントテキスト２　DLC4_040　　　三行目{LF}ヒントテキスト２　DLC4_040　　　四行目{LF}ヒントテキスト２　DLC4_040　　　五行目{#Name=""Pirate fleet (2)""}","ヒントテキスト２　DLC4_040　　　一行目{LF}ヒントテキスト２　DLC4_040　　　二行目{LF}ヒントテキスト２　DLC4_040　　　三行目{LF}ヒントテキスト２　DLC4_040　　　四行目{LF}ヒントテキスト２　DLC4_040　　　五行目{#Name=""Pirate fleet (2)""}","1"
"ヒントテキスト３　DLC4_040　　　一行目{LF}ヒントテキスト３　DLC4_040　　　二行目{LF}ヒントテキスト３　DLC4_040　　　三行目{LF}ヒントテキスト３　DLC4_040　　　四行目{LF}ヒントテキスト３　DLC4_040　　　五行目{#Name=""Pirate fleet (3)""}","ヒントテキスト３　DLC4_040　　　一行目{LF}ヒントテキスト３　DLC4_040　　　二行目{LF}ヒントテキスト３　DLC4_040　　　三行目{LF}ヒントテキスト３　DLC4_040　　　四行目{LF}ヒントテキスト３　DLC4_040　　　五行目{#Name=""Pirate fleet (3)""}","1"
"ヒントテキスト１　DLC3_040　　　一行目{LF}ヒントテキスト１　DLC3_040　　　二行目{LF}ヒントテキスト１　DLC3_040　　　三行目{LF}ヒントテキスト１　DLC3_040　　　四行目{LF}ヒントテキスト１　DLC3_040　　　五行目{#Name=""Special Gigas (1)""}","ヒントテキスト１　DLC3_040　　　一行目{LF}ヒントテキスト１　DLC3_040　　　二行目{LF}ヒントテキスト１　DLC3_040　　　三行目{LF}ヒントテキスト１　DLC3_040　　　四行目{LF}ヒントテキスト１　DLC3_040　　　五行目{#Name=""Special Gigas (1)""}","1"
"ヒントテキスト２　DLC3_040　　　一行目{LF}ヒントテキスト２　DLC3_040　　　二行目{LF}ヒントテキスト２　DLC3_040　　　三行目{LF}ヒントテキスト２　DLC3_040　　　四行目{LF}ヒントテキスト２　DLC3_040　　　五行目{#Name=""Special Gigas (2)""}","ヒントテキスト２　DLC3_040　　　一行目{LF}ヒントテキスト２　DLC3_040　　　二行目{LF}ヒントテキスト２　DLC3_040　　　三行目{LF}ヒントテキスト２　DLC3_040　　　四行目{LF}ヒントテキスト２　DLC3_040　　　五行目{#Name=""Special Gigas (2)""}","1"
"ヒントテキスト３　DLC3_040　　　一行目{LF}ヒントテキスト３　DLC3_040　　　二行目{LF}ヒントテキスト３　DLC3_040　　　三行目{LF}ヒントテキスト３　DLC3_040　　　四行目{LF}ヒントテキスト３　DLC3_040　　　五行目{#Name=""Special Gigas (3)""}","ヒントテキスト３　DLC3_040　　　一行目{LF}ヒントテキスト３　DLC3_040　　　二行目{LF}ヒントテキスト３　DLC3_040　　　三行目{LF}ヒントテキスト３　DLC3_040　　　四行目{LF}ヒントテキスト３　DLC3_040　　　五行目{#Name=""Special Gigas (3)""}","1"
"ヒントテキスト１　DLC2_040　　　一行目{LF}ヒントテキスト１　DLC2_040　　　二行目{LF}ヒントテキスト１　DLC2_040　　　三行目{LF}ヒントテキスト１　DLC2_040　　　四行目{LF}ヒントテキスト１　DLC2_040　　　五行目{#Name=""Homunculus (1)""}","ヒントテキスト１　DLC2_040　　　一行目{LF}ヒントテキスト１　DLC2_040　　　二行目{LF}ヒントテキスト１　DLC2_040　　　三行目{LF}ヒントテキスト１　DLC2_040　　　四行目{LF}ヒントテキスト１　DLC2_040　　　五行目{#Name=""Homunculus (1)""}","1"
"ヒントテキスト２　DLC2_040　　　一行目{LF}ヒントテキスト２　DLC2_040　　　二行目{LF}ヒントテキスト２　DLC2_040　　　三行目{LF}ヒントテキスト２　DLC2_040　　　四行目{LF}ヒントテキスト２　DLC2_040　　　五行目{#Name=""Homunculus (2)""}","ヒントテキスト２　DLC2_040　　　一行目{LF}ヒントテキスト２　DLC2_040　　　二行目{LF}ヒントテキスト２　DLC2_040　　　三行目{LF}ヒントテキスト２　DLC2_040　　　四行目{LF}ヒントテキスト２　DLC2_040　　　五行目{#Name=""Homunculus (2)""}","1"
"ヒントテキスト３　DLC2_040　　　一行目{LF}ヒントテキスト３　DLC2_040　　　二行目{LF}ヒントテキスト３　DLC2_040　　　三行目{LF}ヒントテキスト３　DLC2_040　　　四行目{LF}ヒントテキスト３　DLC2_040　　　五行目{#Name=""Homunculus (3)""}","ヒントテキスト３　DLC2_040　　　一行目{LF}ヒントテキスト３　DLC2_040　　　二行目{LF}ヒントテキスト３　DLC2_040　　　三行目{LF}ヒントテキスト３　DLC2_040　　　四行目{LF}ヒントテキスト３　DLC2_040　　　五行目{#Name=""Homunculus (3)""}","1"
