"translation","source","can_modify"
"Há muito tempo, em uma era manchada por conflitos intermináveis,{#Name=""Velho Homem""}","Long ago, in an age tarnished by endless conflict,{#Name=""Old Man""}","0"
"cinco belas deusas desceram sobre a terra.{#Name=""Velho Homem""}","five beautiful goddesses descended upon the land.{#Name=""Old Man""}","0"
"As deusas cantaram canções místicas que restauraram{LF}paz e harmonia ao nosso mundo quebrado.{#Name=""Velho Homem""}","The goddesses sang mystical songs that restored{LF}peace and harmony to our broken world.{#Name=""Old Man""}","0"
"As pessoas começaram a adorar essas cantoras sagradas,{#Name=""Velho Homem""}","The people began to worship these holy songstresses,{#Name=""Old Man""}","0"
"e passaram a se referir a elas como ""Intoners.""{#Name=""Velho Homem""}","and came to refer to them as ""Intoners.""{#Name=""Old Man""}","0"
"Graças aos esforços dessas Intoners,{LF}o caos da guerra se tornou uma memória distante.{#Name=""Velho Homem""}","Thanks to the efforts of these Intoners,{LF}the chaos of war became a distant memory.{#Name=""Old Man""}","0"
"E como resultado, a humanidade desfrutou de uma era de doce sonho,{#Name=""Velho Homem""}","And as a result, mankind enjoyed an age of sweet reverie,{#Name=""Old Man""}","0"
"banhando-se na luz e beleza recém-encontradas—{#Name=""Velho Homem""}","basking in the newfound light and beau—{#Name=""Old Man""}","0"
"V-Você...selvagem assassino...{#Name=""Velho Homem""}","Y-You...murderous savage...{#Name=""Old Man""}","0"
"Selvagem? Eu acho que você quer dizer Intoner.{#Name=""Zero""}","Savage? I think you mean Intoner.{#Name=""Zero""}","0"
"Ela está lá! Pegue-a!{#Name=""Soldado A""}","She's in there! Take her down!{#Name=""Soldier A""}","0"
"Mate o demônio traidor!{#Name=""Soldado C""}","Kill the traitorous demon!{#Name=""Soldier C""}","0"
"Michael...{#Name=""Zero""}","Michael...{#Name=""Zero""}","0"
"É hora...de pôr fim às Intoners.{#Name=""Zero""}","It's time...to put an end to the Intoners.{#Name=""Zero""}","0"
"★ゼロと敵のやりとり。{#Name=""ゼロ""}","★ゼロと敵のやりとり。{#Name=""ゼロ""}","0"
"★ゼロとミカエルのやりとり。{#Name=""ゼロ""}","★ゼロとミカエルのやりとり。{#Name=""ゼロ""}","0"
"★ゼロがウタヒメである事、裏切り者である事の説明。{#Name=""ゼロ""}","★ゼロがウタヒメである事、裏切り者である事の説明。{#Name=""ゼロ""}","0"
"Zero! Vá! Derrote as irmãs!{#Name=""Michael""}","Zero! Go! Defeat your sisters!{#Name=""Michael""}","0"
"{06}>{#Name=""Zero""}","{06}>{#Name=""Zero""}","0"
"Não! Você não tem força para isso!{#Name=""Zero""}","No! You don't have the strength for this!{#Name=""Zero""}","0"
"Esses bonecos não são páreos para um dragão!{#Name=""Michael""}","These puppets are no match for a dragon!{#Name=""Michael""}","0"
"Tudo bem. Só não morra em mim.{#Name=""Zero""}","Fine. Just don't die on me.{#Name=""Zero""}","0"
"Tchau, tolo...{#Name=""Michael""}","Farewell, fool...{#Name=""Michael""}","0"
"Todos vocês...{#Name=""Zero""}","All of you...{#Name=""Zero""}","0"
"Mulheres, crianças, idosos... Não importa.{LF}Se vocês se colocarem no meu caminho, vocês vão morrer.{#Name=""Zero""}","Women, children, the elderly... It doesn't matter.{LF}If you stand in my way, you're gonna die.{#Name=""Zero""}","0"
"343{#Name=""343""}","343{#Name=""343""}","0"
"Se é isso que você quer... então entre na fila!{#Name=""Zero""}","If that's what you want...then get in line!{#Name=""Zero""}","0"
"É ela! É Zero!{#Name=""Soldado A""}","It's her! It's Zero!{#Name=""Soldier A""}","0"
"Ela parece tão sinistra... É ela realmente uma Intoner?{#Name=""Soldado F""}","She looks so sinister... Is she really an Intoner?{#Name=""Soldier F""}","0"
"Hyaaaa! Fiquem atentos, homens! Mantenham nossas Intoners seguras!{#Name=""Soldado B""}","Hyaaaa! Look sharp, men! Keep our Intoners safe!{#Name=""Soldier B""}","0"
"Lutem com inteligência! Morrer aqui não alcança nada!{#Name=""Soldado E""}","Fight smart! Dying here accomplishes nothing!{#Name=""Soldier E""}","0"
"O dragão é muito forte!{#Name=""Soldado C""}","The dragon's too strong!{#Name=""Soldier C""}","0"
"Alguém me ajude!{#Name=""Soldado D""}","Somebody help me!{#Name=""Soldier D""}","0"
"Uma guerra entre Intoners... Verdadeiramente o mundo enlouqueceu.{#Name=""Soldado F""}","A war between Intoners... Truly the world has gone mad.{#Name=""Soldier F""}","0"
"É o fim... Vamos todos morrer...{#Name=""Soldado G""}","It's over... We're all going to die...{#Name=""Soldier G""}","0"
"Continuem! Não percam a esperança!{#Name=""Soldado F""}","Keep it up! Don't lose hope!{#Name=""Soldier F""}","0"
"Não recuem! Zero deve ser parada!{#Name=""Soldado A""}","No retreat! Zero must be stopped!{#Name=""Soldier A""}","0"
"O demônio está tentando matar suas irmãs!{#Name=""Soldier B""}","The demon's trying to kill her sisters!{#Name=""Soldier B""}","0"
"Mate o traidor! Devemos proteger nossa terra natal!{#Name=""Soldier E""}","Kill the traitor! We must protect our homeland!{#Name=""Soldier E""}","0"
"Se isso continuar, nosso mundo como conhecemos está acabado...{#Name=""Soldier F""}","If this keeps up, our world as we know it is over...{#Name=""Soldier F""}","0"
"Não vamos deixar que isso aconteça!{#Name=""Soldier B""}","We're not about to let that happen!{#Name=""Soldier B""}","0"
"Merda, meu arco quebrou!{#Name=""Soldier G""}","Shit, my bow broke!{#Name=""Soldier G""}","0"
"Toma, use o meu!{#Name=""Soldier A""}","Here, use mine!{#Name=""Soldier A""}","0"
"Mas...{#Name=""Soldier G""}","But...{#Name=""Soldier G""}","0"
"Vocês jovens recrutas devem viver para lutar outro dia.{#Name=""Soldier A""}","You young recruits must live to fight another day.{#Name=""Soldier A""}","0"
"Temos que parar esse dragão...{#Name=""Soldier C""}","We have to stop that dragon...{#Name=""Soldier C""}","0"
"Ele deve ter um ponto fraco! Encontre!{#Name=""Soldier E""}","It must have a weak point! Find it!{#Name=""Soldier E""}","0"
"Graaarrrgh!{#Name=""Soldier F""}","Graaarrrgh!{#Name=""Soldier F""}","0"
"Ei! Você está bem?{#Name=""Soldier B""}","Hey! You okay?{#Name=""Soldier B""}","0"
"Vá em frente. Não se mate por minha causa...{#Name=""Soldier F""}","Go on. Don't get yourself killed on my account...{#Name=""Soldier F""}","0"
"Não... Droga, não!{#Name=""Soldier B""}","No... Dammit, no!{#Name=""Soldier B""}","0"
"Ugh. Ela é tão forte!{#Name=""Soldier A""}","Ugh. She's so strong!{#Name=""Soldier A""}","0"
"A essa taxa, ela vai alcançar os Intoners em breve!{#Name=""Soldier G""}","At this rate, she's gonna reach the Intoners soon!{#Name=""Soldier G""}","0"
"Nunca. Devemos protegê-los com nossas vidas!{#Name=""Soldier A""}","Never. We must protect them with our lives!{#Name=""Soldier A""}","0"
"Como podemos nos opor a um Intoner e um dragão?{#Name=""Soldier E""}","How can we stand against an Intoner and a dragon?{#Name=""Soldier E""}","0"
"Que escolha temos!? Todos os homens, tomem posição! Ataque!{#Name=""Soldier A""}","What choice do we have!? All men, take position! Attaaack!{#Name=""Soldier A""}","0"
"Seu túmulo o espera, apóstata!{#Name=""Soldier B""}","Your grave beckons, apostate!{#Name=""Soldier B""}","0"
"Morra, você maldito traidor Intonador!{#Name=""Soldier G""}","Die, you damned traitorous Intoner!{#Name=""Soldier G""}","0"
"Eu poderia levar você mais a sério se sua voz{LF}não estivesse tremendo...{#Name=""Zero""}","I might take you more seriously if your voice{LF}wasn't quivering...{#Name=""Zero""}","0"
"Por que uma Intoner está matando a sua própria?{#Name=""Soldier A""}","Why is an Intoner killing her own?{#Name=""Soldier A""}","0"
"Devemos contar a eles? Eles parecem genuinamente curiosos.{#Name=""Michael""}","Shall we tell them? They seem genuinely curious.{#Name=""Michael""}","0"
"Por que se importar? Eles estão prestes a morrer de qualquer maneira.{#Name=""Zero""}","Why bother? They're about to die anyway.{#Name=""Zero""}","0"
"O fim do mundo está próximo...{#Name=""Soldier F""}","The end of the world is nigh...{#Name=""Soldier F""}","0"
"343{#Name=""343""}","343{#Name=""343""}","0"
"Eles...me disseram que os Intonadores eram{LF}supostos ser pacíficos!{#Name=""Soldier E""}","They...they told me Intoners were{LF}supposed to be peaceful!{#Name=""Soldier E""}","0"
"Que tipo de lixo estão ensinando{LF}você pessoas esses dias?{#Name=""Zero""}","What kind of crap are they teaching{LF}you people these days?{#Name=""Zero""}","0"
"Chame um médico! Essa Intoner louca vai nos matar todos!{#Name=""Soldier C""}","Get a medic! This crazy Intoner's gonna kill us all!{#Name=""Soldier C""}","0"
"Claro, por que não? Eu ainda não matei nenhum médico.{#Name=""Zero""}","Sure, why not? I haven't killed any medics yet.{#Name=""Zero""}","0"
"Saia do meu caminho, droga!{#Name=""Zero""}","Get outta my way, dammit!{#Name=""Zero""}","0"
"Seja calmo, Zero. A raiva só vai retardar sua espada.{#Name=""Michael""}","Be calm, Zero. Anger will only slow your sword.{#Name=""Michael""}","0"
"Olhe, eu sei disso, é só... Ah, esqueça!{#Name=""Zero""}","Look, I know that, it's just... Ah, forget it!{#Name=""Zero""}","0"
"Michael! Acabe com eles!{#Name=""Zero""}","Michael! Take 'em out!{#Name=""Zero""}","0"
"Como você deseja.{#Name=""Michael""}","As you wish.{#Name=""Michael""}","0"
"Onde diabos estão minhas irmãs?{#Name=""Zero""}","Where the hell are my sisters?{#Name=""Zero""}","0"
"Você tem certeza disso, Zero?{LF}Sobre matar todos os Intoners?{#Name=""Michael""}","Are you certain about this, Zero?{LF}About slaying all the Intoners?{#Name=""Michael""}","0"
"Claro. Por que mais eu estaria esfaqueando todos?{#Name=""Zero""}","Of course. Why else would I be stabbing everyone?{#Name=""Zero""}","0"
"Maldito...traidor...Intoner!{#Name=""Soldier A""}","Damned...traitorous...Intoner!{#Name=""Soldier A""}","0"
"Você ouve isso? Todos o chamam de traidor.{#Name=""Michael""}","Do you hear that? They all name you traitor.{#Name=""Michael""}","0"
"Já fui chamado de pior.{#Name=""Zero""}","I've been called worse.{#Name=""Zero""}","0"
"Mate a besta nojenta! Derrube-a!{#Name=""Soldier B""}","Kill the foul beast! Bring it down!{#Name=""Soldier B""}","0"
"Eles me veem como algum tipo de monstro.{#Name=""Michael""}","They view me as some kind of monster.{#Name=""Michael""}","0"
"É, não me preocuparia com isso.{#Name=""Zero""}","Yeah, I wouldn't worry about it.{#Name=""Zero""}","0"
"Não estou fazendo nada disso.{#Name=""Michael""}","I'm doing nothing of the sort.{#Name=""Michael""}","0"
"Heh. Você sempre foi do tipo sensível.{#Name=""Zero""}","Heh. You always were the sensitive type.{#Name=""Zero""}","0"
"Não sou nada disso!{#Name=""Michael""}","I am nothing of the sort!{#Name=""Michael""}","0"
"Oh, diabo. O que é isso?{#Name=""Zero""}","Oh, hell. What's this thing?{#Name=""Zero""}","0"
"Não é humano... E ainda, não é bem uma besta.{#Name=""Michael""}","It's no human... And yet, not quite a beast.{#Name=""Michael""}","0"
"Provavelmente algum tipo de autômato criado pelos{LF}Intoners.{#Name=""Michael""}","Likely some sort of automaton devised by{LF}the Intoners.{#Name=""Michael""}","0"
"Bastardos astutos...{#Name=""Zero""}","Crafty little bastards...{#Name=""Zero""}","0"
"Homens, tomem suas posições! Fiquem fortes!{#Name=""Soldier A""}","Men, take your positions! Stand strong!{#Name=""Soldier A""}","0"
"Saia. Da. Minha. FRENTE!{#Name=""Zero""}","Get. Out of. My WAY!{#Name=""Zero""}","0"
"Não deixe ela passar!","Don't let her through!{#Name=""Soldier B""}","0"
"Mova!","Move!{#Name=""Zero""}","0"
"{06}>","{06}>{#Name=""Soldier B""}","0"
"Ela não pode ser uma Intoner... Não há como!","She can't be an Intoner... There's no way!{#Name=""Soldier G""}","0"
"Ela é um demônio danado...","She's a damned demon...{#Name=""Soldier F""}","0"
"Não há como podemos vencer... Vamos todos morrer!","There's no way we can win...{LF}We're all gonna die!{#Name=""Soldier G""}","0"
"Não é hora para covardia! Fique firme e lute!","This is no time for cowardice!{LF}Stand tall and fight!{#Name=""Soldier B""}","0"
"Oh, Deus... Não, não, não, não, nãoooo!","Oh, God... No, no, no, no, noooo!{#Name=""Soldier G""}","0"
"Malditos recrutas civis chorões... Carregue! Carregue agora!","Damn sniveling civilian recruits...{LF}Charge! Charge now!{#Name=""Soldier B""}","0"
"Nossos mensageiros estão mortos! Chame mais!","Our messengers are dead! Summon more!{#Name=""Soldier C""}","0"
"Eles nunca chegarão a tempo!","They'll never arrive in time!{#Name=""Soldier D""}","0"
"Olhe para ela... Olhe como ela é rápida!","Look at her... Look how fast she is!{#Name=""Soldier C""}","0"
"Merda! Ela está vindo em nossa direção! Corra!","Shit! She's coming this way! Ruuun!{#Name=""Soldier D""}","0"
"Este mundo não pode sobreviver sem Intoners.","This world can't survive without Intoners.{#Name=""Soldier F""}","0"
"Se queremos que os bons Intonadores vivam...","If we want the good Intoners to live...{#Name=""Soldier F""}","0"
"então a traidora deve morrer!","then the traitorous one must die!{#Name=""Soldier F""}","0"
"Pare de falar besteira, por favor?","Shut up with the bullshit already, would you?{#Name=""Zero""}","0"
"Recuar! Todos, recuem!","Fall back! Everyone, fall back!{#Name=""Soldier A""}","0"
"O quê!? Se abandonarmos nossos postos,{LF}os Intoners estarão em perigo!{#Name=""Soldier B""}","What!? If we abandon our posts,{LF}the Intoners will be in danger!{#Name=""Soldier B""}","0"
"Você realmente acha que eu me importo agora!?{#Name=""Soldier A""}","You really think I give a shit right now!?{#Name=""Soldier A""}","0"
"Volte ao normal, você covarde patético!{LF}Você é um soldado!{#Name=""Soldier B""}","Snap out of it, you pathetic craven!{LF}You're a soldier!{#Name=""Soldier B""}","0"
"Mova, mova, mova, MOVIMENTE!{#Name=""Zero""}","Move, move, move, MOVE!{#Name=""Zero""}","0"
"É a Zero! Zero a traidora!{#Name=""Soldier E""}","It's Zero! Zero the betrayer!{#Name=""Soldier E""}","0"
"Saia da minha frente!{#Name=""Zero""}","Get the hell outta my way!{#Name=""Zero""}","0"
"Oh merda, ela está aqui! Recuar! Recuar!{#Name=""Soldier D""}","Oh crap, she's here! Retreat! Retreeeat!{#Name=""Soldier D""}","0"
"Saia da minha frente!{#Name=""Soldier C""}","Outta my way!{#Name=""Soldier C""}","0"
"Como...como isso pode ter acontecido...?{#Name=""Soldier D""}","How...how could this happen...?{#Name=""Soldier D""}","0"
"Aguente, minhas irmãs amadas.{LF}Estou vindo matar vocês todas.{#Name=""Zero""}","Hold on, my beloved sisters.{LF}I'm coming to kill you all.{#Name=""Zero""}","0"
"Derrote o Titã!{#Name="" ""}","Defeat the Titan!{#Name="" ""}","0"
"Encontre e vença suas irmãs na Catedral.{#Name="" ""}","Find and defeat your sisters at the Cathedral.{#Name="" ""}","0"
