"translation","source","can_modify"
"Dummy{#Name=""Dummy""}","ダミー{#Name=""ダミー""}","1"
"Dummy{#Name=""Dummy""}","ダミー{#Name=""ダミー""}","1"
"Dummy{#Name=""Dummy""}","ダミー{#Name=""ダミー""}","1"
"Dummy{#Name=""Dummy""}","ダミー{#Name=""ダミー""}","1"
"Dummy{#Name=""Dummy""}","ダミー{#Name=""ダミー""}","1"
"Dummy{#Name=""Dummy""}","ダミー{#Name=""ダミー""}","1"
"Dummy{#Name=""Dummy""}","ダミー{#Name=""ダミー""}","1"
"Dummy{#Name=""Dummy""}","ダミー{#Name=""ダミー""}","1"
"Dummy{#Name=""Dummy""}","ダミー{#Name=""ダミー""}","1"
"Dummy{#Name=""Dummy""}","ダミー{#Name=""ダミー""}","1"
"Dummy{#Name=""Dummy""}","ダミー{#Name=""ダミー""}","1"
"What the hell is that?{#Name=""Zero""}","What the hell is that?{#Name=""Zero""}","1"
"Dummy{#Name=""Dummy""}","ダミー{#Name=""ダミー""}","1"
"Dummy{#Name=""Dummy""}","ダミー{#Name=""ダミー""}","1"
"Make your way toward the Shrine of Seas.{#Name=""Explanation""}","Make your way toward the Shrine of Seas.{#Name=""説明文""}","1"
"Defeat the enemy soldiers!{#Name=""Explanation""}","Defeat the enemy soldiers!{#Name=""説明文""}","1"
"Defeat the enemy soldiers!{#Name=""Explanation""}","Defeat the enemy soldiers!{#Name=""説明文""}","1"
"Defeat the Gigas!{#Name=""Explanation""}","Defeat the Gigas!{#Name=""説明文""}","1"
"4 enemies remaining!{#Name=""Explanation""}","敵残り 4 体！{#Name=""説明文""}","1"
"Ah! Aaaah! She's gonna get me!{#Name=""Soldier G""}","Ah! Aaaah! She's gonna get me!{#Name=""Soldier G""}","1"
"Stand firm!{#Name=""Soldier A""}","Stand firm!{#Name=""Soldier A""}","1"
"We won't let her lay a finger on Lady Five!{#Name=""Soldier B""}","We won't let her lay a finger on Lady Five!{#Name=""Soldier B""}","1"
"I'd like to lay somethin' on Lady Five...{#Name=""Soldier E""}","I'd like to lay somethin' on Lady Five...{#Name=""Soldier E""}","1"
"What the hell? An eye socket is no place to be growin' a flower!{#Name=""Soldier C""}","What the hell? An eye socket is no place to be growin' a flower!{#Name=""Soldier C""}","1"
"She gets points for originality...{#Name=""Soldier D""}","She gets points for originality...{#Name=""Soldier D""}","1"
"Dummy{#Name=""Dummy""}","ダミー{#Name=""ダミー""}","1"
"I'll tear you apart!{#Name=""Soldier B""}","I'll tear you apart!{#Name=""Soldier B""}","1"
"So war has come to the Land of Seas...{#Name=""Soldier F""}","So war has come to the Land of Seas...{#Name=""Soldier F""}","1"
"Dummy{#Name=""Dummy""}","ダミー{#Name=""ダミー""}","1"
"Dummy{#Name=""Dummy""}","ダミー{#Name=""ダミー""}","1"
"(Panicked, frightened breathing){#Name=""Soldier G""}","(Panicked, frightened breathing){#Name=""Soldier G""}","1"
"Não se esqueça de se controlar, garoto!","Try not to piss yourself, kid!{#Name=""Soldier B""}","1"
"Se lutarmos bravamente, podemos ter uma audiência com a Senhora Cinco!","If we fight bravely, we might get an audience with Lady Five!{#Name=""Soldier C""}","1"
"Ooh! E então vamos ver aquelas pernas lindas!","Ooh! And then we'll get to see them beautiful gams!{#Name=""Soldier D""}","1"
"Chaaaaaaaaaarge!","Chaaaaaaaaaarge!{#Name=""Soldiers C/D""}","1"
"Ela está atrás da nossa Intoner! Pare-a, não importa o que!","She's after our Intoner! Stop her, no matter what!{#Name=""Soldier A""}","1"
"Onde estão os reforços malditos!?","Where are the damn reinforcements!?{#Name=""Soldier E""}","1"
"O d-dragão... O dragão está...","The d-dragon... The dragon is...{#Name=""Soldier G""}","1"
"Pensei que dragões não se importavam com as pessoas! O que está acontecendo!?","I thought dragons didn't care about people! What's going on!?{#Name=""Soldier C""}","1"
" "," {#Name=""兵士C""}","1"
"Ela está de alguma forma controlando aquele dragão...","She's somehow able to control that dragon...{#Name=""Soldier C""}","1"
"Mantenha sua espada erguida, idiota! Você quer morrer?","Keep your sword up, fool! You want to die?{#Name=""Soldier E""}","1"
"Eu...Eu não posso! Estou com medo!","I...I can't! I'm scared!{#Name=""Soldier G""}","1"
"Você acha que o resto de nós está DESFRUTANDO disso!?","You think the rest of us are ENJOYING this!?{#Name=""Soldier E""}","1"
"Onde está a Senhora Cinco!?","Where's Lady Five!?{#Name=""Soldier B""}","1"
"Ela está com Dito! Ela está segura!","She's with Dito! She's safe!{#Name=""Soldier A""}","1"
"Bah! Por que ela desperdiça tempo com aquele garoto patético?","Bah! Why does she waste time with that pathetic kid?{#Name=""Soldier B""}","1"
"Nossas vidas são um sacrifício para a nossa poderosa Intoner!","Our lives are sacrifice to our mighty Intoner!{#Name=""Soldier A""}","1"
"Raaaaaagh!","Raaaaaagh!{#Name=""Soldier B""}","1"
"Só uma vez...antes de morrer...eu queria estar com a Lady Cinco...","Just once...before I died...I wanted to be with Lady Five...{#Name=""Soldier B""}","1"
"Maldição, Zero!","Damn you, Zero!{#Name=""Soldier C""}","1"
"Não podemos segurá-la! Precisamos de apoio!","We can't hold her! We need support!{#Name=""Soldier D""}","1"
"Sua lâmina é tão rápida...","Her blade is so fast...{#Name=""Soldier E""}","1"
"É habilidade? Ou algo mais?","Is it skill? Or something else?{#Name=""Soldier F""}","1"
"Afaste-se! Afaste-se de mim!","Get away! Get away from me!{#Name=""Soldier G""}","1"
"Não podemos fazer contato com nenhum de nossos aliados...","We can't make contact with any of our allies...{#Name=""Soldier A""}","1"
"Se isso continuar, vamos todos ser comida de verme!","If this keeps up, we're all gonna be worm food!{#Name=""Soldier B""}","1"
"Nossa, olhe para todos eles! Eles estão em todos os lugares!","Wow, look at all of them! They're everywhere!{#Name=""Mikhail""}","1"
"Eles são como formigas para você. Apenas esmague-os.","They're like ants to you. Just crush 'em.{#Name=""Zero""}","1"
"Isso é muito cruel, Zero...","That's really mean, Zero...{#Name=""Mikhail""}","1"
"Nossa, olhe para a água aqui! É tão bonita!","Wow, look at the water here! It's so pretty!{#Name=""Mikhail""}","1"
"Só afunde o maldito navio de guerra, vai?","Just sink the goddamn battleship, will you?{#Name=""Zero""}","1"
"Fiiine...","Fiiine...{#Name=""Mikhail""}","1"
"Não acho que possa quebrar essa barricada.","I don't think I can break this barricade.{#Name=""Zero""}","1"
"Acho que vou ter que subir e ir{LF}em volta de alguma forma.","Guess I'll just have to climb up and go{LF}around somehow.{#Name=""Zero""}","1"
"Heh. Isso é uma maneira meio patética de{LF}tentar me retardar...","Heh. That's a pretty half-assed way to{LF}try and slow me down...{#Name=""Zero""}","1"
"Então...que tipo de irmã é a Cinco?","So...what kind of sister is Five?{#Name=""Mikhail""}","1"
"O tipo puta.{#Name=""Zero""}","The slutty kind.{#Name=""Zero""}","1"
"O que significa ""puta""?{#Name=""Mikhail""}","What's ""slutty"" mean?{#Name=""Mikhail""}","1"
"Isso significa que tudo que ela pensa é sobre coisas sujas.{#Name=""Zero""}","It means all she thinks about is dirty stuff.{#Name=""Zero""}","1"
"Ah. Então ela é apenas como você!{#Name=""Mikhail""}","Oh. So she's just like you!{#Name=""Mikhail""}","1"
"Você pode calar a boca já?{#Name=""Zero""}","Would you shut up already?{#Name=""Zero""}","1"
"Parece que as pessoas costumavam viver aqui em algum momento.{#Name=""Zero""}","Looks like people used to live here at some point.{#Name=""Zero""}","1"
"Deve ser legal viver perto do mar.{LF}Pense em todos os peixes deliciosos!{#Name=""Mikhail""}","Must be nice living near the sea.{LF}Think of all the yummy fish!{#Name=""Mikhail""}","1"
"O que diabos? Onde está o santuário?{#Name=""Zero""}","What the hell? Where's the shrine?{#Name=""Zero""}","1"
"163{#Name=""163""}","163{#Name=""163""}","1"
"361{#Name=""361""}","361{#Name=""361""}","1"
"Droga. Acho que fomos enganados.{#Name=""Zero""}","Dammit. I think we've been had.{#Name=""Zero""}","1"
"……Feliz, né?{#Name=""ゼロ""}","……嬉しそうだな{#Name=""ゼロ""}","1"
"Mas, não precisamos lutar e tudo ficou bem{#Name=""ミハイル""}","だって、戦わなくてもよくなったもん{#Name=""ミハイル""}","1"
"289{#Name=""289""}","289{#Name=""289""}","1"
"217{#Name=""217""}","217{#Name=""217""}","1"
"Heh. O que você está olhando, babaca?{#Name=""Zero""}","Heh. What are you looking at, shithead?{#Name=""Zero""}","1"
"Hora de acabar com isso!{#Name=""Zero""}","Time to end this!{#Name=""Zero""}","1"
"Zero, cuidado!{#Name=""Mikhail""}","Zero, look out!{#Name=""Mikhail""}","1"
"Nossa, você é muito forte!{#Name=""Mikhail""}","Wow, you sure are strong!{#Name=""Mikhail""}","1"
"Heh. Olhe para isso. Por que os caras grandes{LF}são tão lentos e estúpidos?{#Name=""Zero""}","Heh. Look at this. Why are big guys{LF}so slow and stupid?{#Name=""Zero""}","1"
"Ei! Eu sou um cara grande!{#Name=""Mikhail""}","Hey! I'm a big guy!{#Name=""Mikhail""}","1"
"Lento e estúpido.{#Name=""Zero""}","Sloooooow and stupid.{#Name=""Zero""}","1"
"Você não precisa dizer duas vezes!{#Name=""Mikhail""}","You don't have to say it twice!{#Name=""Mikhail""}","1"
"Seja o que for, se estiver no meu caminho,{LF}está indo para baixo.{#Name=""Zero""}","Whatever it is, if it gets in my way,{LF}it's going down.{#Name=""Zero""}","1"
"Tenha cuidado, Zero! Esse cara é forte!{LF}Super forte!{#Name=""Mikhail""}","Just be careful, Zero! This guy's strong!{LF}Super strong!{#Name=""Mikhail""}","1"
"217{#Name=""217""}","217{#Name=""217""}","1"
"253{#Name=""253""}","253{#Name=""253""}","1"
"199{#Name=""199""}","199{#Name=""199""}","1"
"289{#Name=""289""}","289{#Name=""289""}","1"
"Pffft. Ela acha que isso vai ser suficiente para me parar?{#Name=""Zero""}","Pfft. She thinks that'll be enough to stop me?{#Name=""Zero""}","1"
"Zero! Olhe!{#Name=""Mikhail""}","Zero! Look!{#Name=""Mikhail""}","1"
"Algo está subindo! Está subindo!{#Name=""Mikhail""}","Something's rising up! It's rising!{#Name=""Mikhail""}","1"
"Heh. Eles estão realmente preparando o tapete vermelho.{#Name=""Zero""}","Heh. They're really rolling out the red carpet.{#Name=""Zero""}","1"
"Tudo bem, Cinco. Vamos ver o que você tem.{#Name=""Zero""}","All right, Five. Let's see what you've got.{#Name=""Zero""}","1"
"Então...o que acontece quando você mata todas as suas irmãs?{#Name=""Mikhail""}","So...what happens once you kill all your sisters?{#Name=""Mikhail""}","1"
"Eu como elas.{#Name=""Zero""}","I eat 'em.{#Name=""Zero""}","1"
"Aaaaaah!{#Name=""Mikhail""}","Aaaaaah!{#Name=""Mikhail""}","1"
"Só brincadeira.{#Name=""Zero""}","Just kidding.{#Name=""Zero""}","1"
"Oh...uh... Ha ha! Eu realmente acreditei em você!{#Name=""Mikhail""}","Oh...uh... Ha ha! I totally believed you!{#Name=""Mikhail""}","1"
"Uma vez que eu as mate, posso explorar seus poderes.{#Name=""Zero""}","Once I kill them, I can exploit their powers.{#Name=""Zero""}","1"
"Então você vai roubar a magia de Intoner delas{LF}e outras coisas?{#Name=""Mikhail""}","So you're going steal their Intoner magic{LF}and stuff?{#Name=""Mikhail""}","1"
"Algo assim.{#Name=""Zero""}","Something like that.{#Name=""Zero""}","1"
