"translation","source","can_modify"
"ゼロッ！先に渡るための橋が落ちてるよ！{#Name=""ミハイル""}","ゼロッ！先に渡るための橋が落ちてるよ！{#Name=""ミハイル""}","1"
"チッ……ミハイルは先に行け！私は他の道を探してみる！{#Name=""ゼロ""}","チッ……ミハイルは先に行け！私は他の道を探してみる！{#Name=""ゼロ""}","1"
"ドラゴンだ！ゼロがっ……ゼロが攻めてきたぞ！{#Name=""敵兵Ａ""}","ドラゴンだ！ゼロがっ……ゼロが攻めてきたぞ！{#Name=""敵兵Ａ""}","1"
"総員！持ち場につけっ！{#Name=""敵兵Ｂ""}","総員！持ち場につけっ！{#Name=""敵兵Ｂ""}","1"
"ここから……行けそうだな{#Name=""ゼロ""}","ここから……行けそうだな{#Name=""ゼロ""}","1"
"ゼロだ！ゼロが来たぞっ！{#Name=""敵兵Ａ""}","ゼロだ！ゼロが来たぞっ！{#Name=""敵兵Ａ""}","1"
"フォウ様の為にも！ここで食い止める！{#Name=""敵兵Ｂ""}","フォウ様の為にも！ここで食い止める！{#Name=""敵兵Ｂ""}","1"
"殺せ！裏切り者のゼロを殺すんだ！{#Name=""敵兵Ａ""}","殺せ！裏切り者のゼロを殺すんだ！{#Name=""敵兵Ａ""}","1"
"フォウ様！私たちに力を……っ！{#Name=""敵兵Ｂ""}","フォウ様！私たちに力を……っ！{#Name=""敵兵Ｂ""}","1"
"{06}>{#Name=""Zero""}","{06}>{#Name=""Zero""}","1"
"Hmph.{#Name=""Zero""}","Hmph.{#Name=""Zero""}","1"
"Zero!{#Name=""Mikhail""}","Zero!{#Name=""Mikhail""}","1"
"Hmm?{#Name=""Zero""}","Hmm?{#Name=""Zero""}","1"
"{06}>{#Name=""Zero""}","{06}>{#Name=""Zero""}","1"
"{06}>{#Name=""Zero""}","{06}>{#Name=""Zero""}","1"
"{06}>{#Name=""Zero""}","{06}>{#Name=""Zero""}","1"
"Zero! Are you okay!?{#Name=""Mikhail""}","Zero! Are you okay!?{#Name=""Mikhail""}","1"
"{06}>{#Name=""Zero""}","{06}>{#Name=""Zero""}","1"
"{06}>{#Name=""Zero""}","{06}>{#Name=""Zero""}","1"
"Holy shit...{#Name=""Dito""}","Holy shit...{#Name=""Dito""}","1"
"So...that's how an Intoner regenerates...?{#Name=""Dito""}","So...that's how an Intoner regenerates...?{#Name=""Dito""}","1"
"This can't end...until all of them are dead.{#Name=""Zero""}","This can't end...until all of them are dead.{#Name=""Zero""}","1"
"It can't end.{#Name=""Zero""}","It can't end.{#Name=""Zero""}","1"
"Zero...{#Name=""Mikhail""}","Zero...{#Name=""Mikhail""}","1"
"Break through the enemy's defenses.{#Name=""説明文""}","Break through the enemy's defenses.{#Name=""説明文""}","1"
"Defeat the enemy soldiers!{#Name=""説明文""}","Defeat the enemy soldiers!{#Name=""説明文""}","1"
"Defeat the Cerberus!{#Name=""説明文""}","Defeat the Cerberus!{#Name=""説明文""}","1"
"Defeat the Cerberus!{#Name=""説明文""}","Defeat the Cerberus!{#Name=""説明文""}","1"
"She's here! The demon Intoner is here!{#Name=""Soldier C""}","She's here! The demon Intoner is here!{#Name=""Soldier C""}","1"
"Dammit. I knew she'd come. We all should've known!{#Name=""Soldier D""}","Dammit. I knew she'd come. We all should've known!{#Name=""Soldier D""}","1"
"Dragon!{#Name=""Soldier A""}","Dragon!{#Name=""Soldier A""}","1"
"An Intoner atop a dragon? This must be the end of the world!{#Name=""Soldier F""}","An Intoner atop a dragon? This must be the end of the world!{#Name=""Soldier F""}","1"
"An Intoner atop a dragon? {LF}This must be the end of the world!{#Name=""兵士B""}","An Intoner atop a dragon? {LF}This must be the end of the world!{#Name=""兵士B""}","1"
"You could never understand what Lady Four means to us!{#Name=""Soldier C""}","You could never understand what Lady Four means to us!{#Name=""Soldier C""}","1"
"虫ならまだいいんじゃないか？{#Name=""兵士B""}","虫ならまだいいんじゃないか？{#Name=""兵士B""}","1"
"We've gotta do everything we can here!{#Name=""Soldier G""}","We've gotta do everything we can here!{#Name=""Soldier G""}","1"
"Yeah, until the dragon stomps us into pudding...{#Name=""Soldier E""}","Yeah, until the dragon stomps us into pudding...{#Name=""Soldier E""}","1"
"Lady Four is under siege!{#Name=""Soldier G""}","Lady Four is under siege!{#Name=""Soldier G""}","1"
"What can we possibly do...?{#Name=""Soldier F""}","What can we possibly do...?{#Name=""Soldier F""}","1"
"不憫なウタヒメ様だよな{#Name=""兵士B""}","不憫なウタヒメ様だよな{#Name=""兵士B""}","1"
"Wow, dragons are HUGE!{#Name=""Soldier D""}","Wow, dragons are HUGE!{#Name=""Soldier D""}","1"
"Watch the tail! It'll kill you in a single blow!{#Name=""Soldier C""}","Watch the tail! It'll kill you in a single blow!{#Name=""Soldier C""}","1"
"Save your breath! Here it comes!{#Name=""Soldier A""}","Save your breath! Here it comes!{#Name=""Soldier A""}","1"
"じゃあ、丸焼きか。俺ら全員、黒こげか{#Name=""兵士C""}","じゃあ、丸焼きか。俺ら全員、黒こげか{#Name=""兵士C""}","1"
"一瞬で焼け死ねたらいいな。瀕死の重症とか嫌だよね{#Name=""兵士D""}","一瞬で焼け死ねたらいいな。瀕死の重症とか嫌だよね{#Name=""兵士D""}","1"
"Did Lady Four get away safely?{#Name=""Soldier A""}","Did Lady Four get away safely?{#Name=""Soldier A""}","1"
"I don't know!{#Name=""Soldier B""}","I don't know!{#Name=""Soldier B""}","1"
"This is such a disaster...{#Name=""Soldier E""}","This is such a disaster...{#Name=""Soldier E""}","1"
"Is Lady Four with Decadus!?{#Name=""Soldier B""}","Is Lady Four with Decadus!?{#Name=""Soldier B""}","1"
"Most likely!{#Name=""Soldier E""}","Most likely!{#Name=""Soldier E""}","1"
"あの巨体のデカート様がいりゃ安心だよな？{#Name=""兵士B""}","あの巨体のデカート様がいりゃ安心だよな？{#Name=""兵士B""}","1"
"どうかな？巨体は目立つからな……{#Name=""兵士E""}","どうかな？巨体は目立つからな……{#Name=""兵士E""}","1"
"Lady Four never makes a poor decision...{#Name=""Soldier A""}","Lady Four never makes a poor decision...{#Name=""Soldier A""}","1"
"Now we must follow in her footsteps!{#Name=""Soldier A""}","Now we must follow in her footsteps!{#Name=""Soldier A""}","1"
"……可能なかぎりで{#Name=""兵士A""}","……可能なかぎりで{#Name=""兵士A""}","1"
"Lady Four's with Decadus. I'm sure she's safe.{#Name=""Soldier B""}","Lady Four's with Decadus. I'm sure she's safe.{#Name=""Soldier B""}","1"
"Let's hope so.{#Name=""Soldier C""}","Let's hope so.{#Name=""Soldier C""}","1"
"Bring it on, demon!{#Name=""Soldier D""}","Bring it on, demon!{#Name=""Soldier D""}","1"
"Damn you, Zero... Damn the accursed Intoner...{#Name=""Soldier E""}","Damn you, Zero... Damn the accursed Intoner...{#Name=""Soldier E""}","1"
"We're under attack! The demon Intoner is here!{#Name=""Soldier F""}","We're under attack! The demon Intoner is here!{#Name=""Soldier F""}","1"
"We're all gonna dieeeee!{#Name=""Soldier G""}","We're all gonna dieeeee!{#Name=""Soldier G""}","1"
"Where should we go, Zero?{#Name=""Mikhail""}","Where should we go, Zero?{#Name=""Mikhail""}","1"
"You got me.{#Name=""Zero""}","You got me.{#Name=""Zero""}","1"
"Huh?{#Name=""Mikhail""}","Huh?{#Name=""Mikhail""}","1"
"How the hell should I know where Four's holed up?{LF}She could be anywhere.{#Name=""Zero""}","How the hell should I know where Four's holed up?{LF}She could be anywhere.{#Name=""Zero""}","1"
"So you don't even know if this is the right path?{#Name=""Mikhail""}","So you don't even know if this is the right path?{#Name=""Mikhail""}","1"
"Nope.{#Name=""Zero""}","Nope.{#Name=""Zero""}","1"
"What the hell, lady!?{#Name=""Dito""}","What the hell, lady!?{#Name=""Dito""}","1"
"Ugh. All of a sudden, my legs feel ten pounds{LF}heavier...{#Name=""Dito""}","Ugh. All of a sudden, my legs feel ten pounds{LF}heavier...{#Name=""Dito""}","1"
"Want me to chop 'em off for ya?{#Name=""Zero""}","Want me to chop 'em off for ya?{#Name=""Zero""}","1"
"...Fine, fine. I'll shut up.{#Name=""Dito""}","...Fine, fine. I'll shut up.{#Name=""Dito""}","1"
"さあ、足を出せ。どちらかぶった斬れば、片足分軽くなる{#Name=""ゼロ""}","さあ、足を出せ。どちらかぶった斬れば、片足分軽くなる{#Name=""ゼロ""}","1"
"……遠慮しとく{#Name=""ディト""}","……遠慮しとく{#Name=""ディト""}","1"
"I'm gonna go on ahead.{#Name=""Mikhail""}","I'm gonna go on ahead.{#Name=""Mikhail""}","1"
"Hey! You can't just fly off while we're stuck{LF}hoofin' it!{#Name=""Dito""}","Hey! You can't just fly off while we're stuck{LF}hoofin' it!{#Name=""Dito""}","1"
"Why not? I'd just get in your way down there!{#Name=""Mikhail""}","Why not? I'd just get in your way down there!{#Name=""Mikhail""}","1"
"And besides, this way I can scout out{LF}what's ahead!{#Name=""Mikhail""}","And besides, this way I can scout out{LF}what's ahead!{#Name=""Mikhail""}","1"
"Huh. Well, have fun being our decoy.{#Name=""Dito""}","Huh. Well, have fun being our decoy.{#Name=""Dito""}","1"
"Hey, dummy? {LF}If you give away our location, I'll kill you.{#Name=""Zero""}","Hey, dummy? {LF}If you give away our location, I'll kill you.{#Name=""Zero""}","1"
"I...I know that...{#Name=""Mikhail""}","I...I know that...{#Name=""Mikhail""}","1"
"And besides, {LF}this way I can scout out what's ahead!{#Name=""ミハイル""}","And besides, {LF}this way I can scout out what's ahead!{#Name=""ミハイル""}","1"
"Zero, check it out! Watch me go!{#Name=""Mikhail""}","Zero, check it out! Watch me go!{#Name=""Mikhail""}","1"
"I'm gonna try double hard and show these{LF}guys just what I'm made of!{#Name=""Mikhail""}","I'm gonna try double hard and show these{LF}guys just what I'm made of!{#Name=""Mikhail""}","1"
"God, he's a handful.{#Name=""Dito""}","God, he's a handful.{#Name=""Dito""}","1"
"Don't you ever get tired of babysitting him?{#Name=""Dito""}","Don't you ever get tired of babysitting him?{#Name=""Dito""}","1"
"Of course. And now I've got two brats to babysit.{#Name=""Zero""}","Of course. And now I've got two brats to babysit.{#Name=""Zero""}","1"
"Whatever, Grandma.{#Name=""Dito""}","Whatever, Grandma.{#Name=""Dito""}","1"
"You wanna die?{#Name=""Zero""}","You wanna die?{#Name=""Zero""}","1"
"Goddammit, Four...{LF}Making me come all the way out here...{#Name=""Zero""}","Goddammit, Four...{LF}Making me come all the way out here...{#Name=""Zero""}","1"
"You're hardly worth hiding{LF}in some secret wild paradise...{#Name=""Zero""}","You're hardly worth hiding{LF}in some secret wild paradise...{#Name=""Zero""}","1"
"All this hiking is gonna turn me{LF}into a muscle-bound freak.{#Name=""Dito""}","All this hiking is gonna turn me{LF}into a muscle-bound freak.{#Name=""Dito""}","1"
"I'm not into the buff, macho look.{LF}Kinda creeps me out.{#Name=""Dito""}","I'm not into the buff, macho look.{LF}Kinda creeps me out.{#Name=""Dito""}","1"
"Don't wanna see it on me, don't wanna{LF}see it on my partner...{#Name=""Dito""}","Don't wanna see it on me, don't wanna{LF}see it on my partner...{#Name=""Dito""}","1"
"Less bitching, more climbing.{#Name=""Zero""}","Less bitching, more climbing.{#Name=""Zero""}","1"
"Ugh, how much further is it? This trail sucks...{#Name=""Dito""}","Ugh, how much further is it? This trail sucks...{#Name=""Dito""}","1"
"I'm sure it beats spending another night with Five.{#Name=""Zero""}","I'm sure it beats spending another night with Five.{#Name=""Zero""}","1"
"You have no idea.{#Name=""Dito""}","You have no idea.{#Name=""Dito""}","1"
"That nympho freak was always making me{LF}try some new kink she'd heard about.{#Name=""Dito""}","That nympho freak was always making me{LF}try some new kink she'd heard about.{#Name=""Dito""}","1"
"What's a kink?{#Name=""Mikhail""}","What's a kink?{#Name=""Mikhail""}","1"
"You don't need to know.{#Name=""Zero""}","You don't need to know.{#Name=""Zero""}","1"
"She's here! It's Zero!{#Name=""Soldier G""}","She's here! It's Zero!{#Name=""Soldier G""}","1"
"She's got some guy with her!{#Name=""Soldier B""}","She's got some guy with her!{#Name=""Soldier B""}","1"
"She's taking hostages now? Dammit!{#Name=""Soldier F""}","She's taking hostages now? Dammit!{#Name=""Soldier F""}","1"
"Wait. That's no hostage. It's a disciple!{#Name=""Soldier A""}","Wait. That's no hostage. It's a disciple!{#Name=""Soldier A""}","1"
"An Intoner, a disciple, AND a dragon!?{#Name=""Soldier C""}","An Intoner, a disciple, AND a dragon!?{#Name=""Soldier C""}","1"
"That's it, we're screwed.{LF}We are so screwed right now.{#Name=""Soldier D""}","That's it, we're screwed.{LF}We are so screwed right now.{#Name=""Soldier D""}","1"
"We've got the terrain advantage!{#Name=""Soldier F""}","We've got the terrain advantage!{#Name=""Soldier F""}","1"
"地の利しかこちらにはない、とも言うがな！{#Name=""兵士E""}","地の利しかこちらにはない、とも言うがな！{#Name=""兵士E""}","1"
"We can't let her past us!{#Name=""Soldier A""}","We can't let her past us!{#Name=""Soldier A""}","1"
"I'll lay down my life if necessary!{#Name=""Soldier B""}","I'll lay down my life if necessary!{#Name=""Soldier B""}","1"
"I'm thinking that's probably gonna be necessary...{#Name=""Soldier E""}","I'm thinking that's probably gonna be necessary...{#Name=""Soldier E""}","1"
"She's so strong! How could we ever...{#Name=""Soldier G""}","She's so strong! How could we ever...{#Name=""Soldier G""}","1"
"All men, sound off!{#Name=""Soldier F""}","All men, sound off!{#Name=""Soldier F""}","1"
"Y-Yes, sir! ...Yaaaahhhh!{#Name=""Soldier G""}","Y-Yes, sir! ...Yaaaahhhh!{#Name=""Soldier G""}","1"
"I had no idea such an Intoner existed...{#Name=""Soldier C""}","I had no idea such an Intoner existed...{#Name=""Soldier C""}","1"
"A far cry from Lady Four.{#Name=""Soldier D""}","A far cry from Lady Four.{#Name=""Soldier D""}","1"
"There is no greater glory than{LF}to die for your Intoner.{#Name=""Soldier F""}","There is no greater glory than{LF}to die for your Intoner.{#Name=""Soldier F""}","1"
"Well, it's even better to LIVE{LF}for your Intoner!{#Name=""Soldier B""}","Well, it's even better to LIVE{LF}for your Intoner!{#Name=""Soldier B""}","1"
"So belay that talk and keep fighting!{#Name=""Soldier B""}","So belay that talk and keep fighting!{#Name=""Soldier B""}","1"
"戦で野垂れ死んで、何がキマる？戦え！{#Name=""兵士B""}","戦で野垂れ死んで、何がキマる？戦え！{#Name=""兵士B""}","1"
"We can't win... We need to flee.{#Name=""Soldier G""}","We can't win... We need to flee.{#Name=""Soldier G""}","1"
"It doesn't matter how hard we fight...{#Name=""Soldier G""}","It doesn't matter how hard we fight...{#Name=""Soldier G""}","1"
"Lady Four can't protect us here!{#Name=""Soldier G""}","Lady Four can't protect us here!{#Name=""Soldier G""}","1"
"Chase her down! Our numbers can overwhelm her!{#Name=""Soldier B""}","Chase her down! Our numbers can overwhelm her!{#Name=""Soldier B""}","1"
"I don't think numbers matter to an Intoner.{#Name=""Soldier E""}","I don't think numbers matter to an Intoner.{#Name=""Soldier E""}","1"
"Get behind her!{#Name=""Soldier A""}","Get behind her!{#Name=""Soldier A""}","1"
"We can do this! ...Most likely! ...I think!{#Name=""Soldier B""}","We can do this! ...Most likely! ...I think!{#Name=""Soldier B""}","1"
"Huh? What's with the flower in her eye?{#Name=""Soldier C""}","Huh? What's with the flower in her eye?{#Name=""Soldier C""}","1"
"Man, just think how strong she was{LF}BEFORE she had her arm replaced...{#Name=""Soldier D""}","Man, just think how strong she was{LF}BEFORE she had her arm replaced...{#Name=""Soldier D""}","1"
"We must give Lady Four time to escape!{#Name=""Soldier E""}","We must give Lady Four time to escape!{#Name=""Soldier E""}","1"
"May Lady Four be forever blessed!{#Name=""Soldier F""}","May Lady Four be forever blessed!{#Name=""Soldier F""}","1"
"Protect her! Protect her! Protect—{LF}Wait, no, protect MEEE!{#Name=""Soldier G""}","Protect her! Protect her! Protect—{LF}Wait, no, protect MEEE!{#Name=""Soldier G""}","1"
"Everything okay, Zero?{#Name=""Mikhail""}","Everything okay, Zero?{#Name=""Mikhail""}","1"
"Surprisingly, yeah.{#Name=""Zero""}","Surprisingly, yeah.{#Name=""Zero""}","1"
"These guys were a cinch once{LF}I softened them up, right?{#Name=""Mikhail""}","These guys were a cinch once{LF}I softened them up, right?{#Name=""Mikhail""}","1"
"Uh...sure.{#Name=""Zero""}","Uh...sure.{#Name=""Zero""}","1"
"You can thank me after the battle's over, okay?{#Name=""Mikhail""}","You can thank me after the battle's over, okay?{#Name=""Mikhail""}","1"
"Assuming you're even alive.{#Name=""Zero""}","Assuming you're even alive.{#Name=""Zero""}","1"
"Ugh, look at those bulging muscles! Gross!{#Name=""Dito""}","Ugh, look at those bulging muscles! Gross!{#Name=""Dito""}","1"
"If any of these meatheads put the moves{LF}on me, I'd stab 'em in the face.{#Name=""Dito""}","If any of these meatheads put the moves{LF}on me, I'd stab 'em in the face.{#Name=""Dito""}","1"
"You need help, Dito?{#Name=""Mikhail""}","You need help, Dito?{#Name=""Mikhail""}","1"
"No offense, but if I'm gonna get help,{LF}I'm gonna get it from Zero.{#Name=""Dito""}","No offense, but if I'm gonna get help,{LF}I'm gonna get it from Zero.{#Name=""Dito""}","1"
"Aw, ask for me! Ask for me, too!{#Name=""Mikhail""}","Aw, ask for me! Ask for me, too!{#Name=""Mikhail""}","1"
"Nngh, what a pain in the ass!{#Name=""Zero""}","Nngh, what a pain in the ass!{#Name=""Zero""}","1"
"Yeah, well, not exactly the roomiest{LF}place for all these guys.{#Name=""Dito""}","Yeah, well, not exactly the roomiest{LF}place for all these guys.{#Name=""Dito""}","1"
"Less talk, more murder.{#Name=""Zero""}","Less talk, more murder.{#Name=""Zero""}","1"
"地形を変えるつもり？{#Name=""ディト""}","地形を変えるつもり？{#Name=""ディト""}","1"
"いや、兵士を殺すんだ{#Name=""ゼロ""}","いや、兵士を殺すんだ{#Name=""ゼロ""}","1"
"Wow, Dito. You're pretty good at killing.{#Name=""Mikhail""}","Wow, Dito. You're pretty good at killing.{#Name=""Mikhail""}","1"
"Yeah, well, I'm a rookie compared{LF}to your boss there.{#Name=""Dito""}","Yeah, well, I'm a rookie compared{LF}to your boss there.{#Name=""Dito""}","1"
"Well, either way, killing is hard, right?{LF}And not very fun.{#Name=""Mikhail""}","Well, either way, killing is hard, right?{LF}And not very fun.{#Name=""Mikhail""}","1"
"Oh yeah. It's hard. Real hard.{#Name=""Dito""}","Oh yeah. It's hard. Real hard.{#Name=""Dito""}","1"
"I cry big salty tears about it every single night.{#Name=""Dito""}","I cry big salty tears about it every single night.{#Name=""Dito""}","1"
"...Is that what you wanted to hear?{LF}Ha ha ha ha ha!{#Name=""Dito""}","...Is that what you wanted to hear?{LF}Ha ha ha ha ha!{#Name=""Dito""}","1"
"There're barricades everywhere.{#Name=""Dito""}","There're barricades everywhere.{#Name=""Dito""}","1"
"Break 'em down!{#Name=""Zero""}","Break 'em down!{#Name=""Zero""}","1"
"It's crazy how much effort Four{LF}spent securing this place.{#Name=""Zero""}","It's crazy how much effort Four{LF}spent securing this place.{#Name=""Zero""}","1"
"That's an Intoner for you.{LF}Excessing to the point of obsession.{#Name=""Dito""}","That's an Intoner for you.{LF}Excessing to the point of obsession.{#Name=""Dito""}","1"
"...Well, present company excepted and all that.{#Name=""Dito""}","...Well, present company excepted and all that.{#Name=""Dito""}","1"
"I could obsess over killing you, you know.{#Name=""Zero""}","I could obsess over killing you, you know.{#Name=""Zero""}","1"
"Me? Uh, that was the enemy speaking!{LF}Go get 'em, tiger!{#Name=""Dito""}","Me? Uh, that was the enemy speaking!{LF}Go get 'em, tiger!{#Name=""Dito""}","1"
"呼んだ？{#Name=""ミハイル""}","呼んだ？{#Name=""ミハイル""}","1"
"遅い！呼んだらスグ来い{#Name=""ゼロ""}","遅い！呼んだらスグ来い{#Name=""ゼロ""}","1"
"そうそう。それがパシリの鉄則だよ{#Name=""ディト""}","そうそう。それがパシリの鉄則だよ{#Name=""ディト""}","1"
"パシリって何？{#Name=""ミハイル""}","パシリって何？{#Name=""ミハイル""}","1"
"すばらしき仲間のことだ{#Name=""ゼロ""}","すばらしき仲間のことだ{#Name=""ゼロ""}","1"
"そっか！がんばるよ、ボク！{#Name=""ミハイル""}","そっか！がんばるよ、ボク！{#Name=""ミハイル""}","1"
"なんか悪い予感がする{#Name=""ディト""}","なんか悪い予感がする{#Name=""ディト""}","1"
"ゼロといっしょにいるからだよ！{#Name=""ミハイル""}","ゼロといっしょにいるからだよ！{#Name=""ミハイル""}","1"
"ボクもいい予感がしたことなんて１度もない！{#Name=""ミハイル""}","ボクもいい予感がしたことなんて１度もない！{#Name=""ミハイル""}","1"
"言い切ったね{#Name=""ディト""}","言い切ったね{#Name=""ディト""}","1"
"Watch out. There's more of 'em.{#Name=""Zero""}","Watch out. There's more of 'em.{#Name=""Zero""}","1"
"Don't know when to quit, huh?{LF}Reminds me of a certain someone...{#Name=""Dito""}","Don't know when to quit, huh?{LF}Reminds me of a certain someone...{#Name=""Dito""}","1"
"無防備にここまで来たのが運の尽きだな{#Name=""兵士A""}","無防備にここまで来たのが運の尽きだな{#Name=""兵士A""}","1"
"こっちには隠し球があるぞっ！{#Name=""兵士B""}","こっちには隠し球があるぞっ！{#Name=""兵士B""}","1"
"ケルベロスを出せっ！{#Name=""兵士E""}","ケルベロスを出せっ！{#Name=""兵士E""}","1"
"いけいけ！やっちまえ、ケルベロス{#Name=""兵士D""}","いけいけ！やっちまえ、ケルベロス{#Name=""兵士D""}","1"
"ウタヒメなんてボロ雑巾にしてしまえ！{#Name=""兵士G""}","ウタヒメなんてボロ雑巾にしてしまえ！{#Name=""兵士G""}","1"
"ケルベロスは両刃の剣となりえよう{#Name=""兵士F""}","ケルベロスは両刃の剣となりえよう{#Name=""兵士F""}","1"
"まあ、アイツにとっちゃ俺達もエサだからな{#Name=""兵士E""}","まあ、アイツにとっちゃ俺達もエサだからな{#Name=""兵士E""}","1"
"恐ろしいことだ。恐ろしいことだ{#Name=""兵士F""}","恐ろしいことだ。恐ろしいことだ{#Name=""兵士F""}","1"
"もはやケルベロスに命運を託すしか……{#Name=""兵士A""}","もはやケルベロスに命運を託すしか……{#Name=""兵士A""}","1"
"やめてくださいよ。そういう捨て鉢な作戦は失敗しますって！{#Name=""兵士G""}","やめてくださいよ。そういう捨て鉢な作戦は失敗しますって！{#Name=""兵士G""}","1"
"じゃあ、オマエがゼロを殺せるか？{#Name=""兵士A""}","じゃあ、オマエがゼロを殺せるか？{#Name=""兵士A""}","1"
"無理無理。無理ですけど{#Name=""兵士G""}","無理無理。無理ですけど{#Name=""兵士G""}","1"
"ゼロが苦戦してるぞ。ざまあみろ！{#Name=""兵士C""}","ゼロが苦戦してるぞ。ざまあみろ！{#Name=""兵士C""}","1"
"あ、ケルベロスがこっち見た{#Name=""兵士D""}","あ、ケルベロスがこっち見た{#Name=""兵士D""}","1"
"やべえ。隠れろ！{#Name=""兵士C""}","やべえ。隠れろ！{#Name=""兵士C""}","1"
"食い殺せ、ケルベロス！{#Name=""兵士B""}","食い殺せ、ケルベロス！{#Name=""兵士B""}","1"
"わっ、呼びかけるなよ。こっち向くぞ{#Name=""兵士C""}","わっ、呼びかけるなよ。こっち向くぞ{#Name=""兵士C""}","1"
"エサは俺達じゃないぞ。そっち！ウタヒメの方！{#Name=""兵士D""}","エサは俺達じゃないぞ。そっち！ウタヒメの方！{#Name=""兵士D""}","1"
"ケルベロスがいれば大丈夫だろう……{#Name=""兵士A""}","ケルベロスがいれば大丈夫だろう……{#Name=""兵士A""}","1"
"本当ですか？{#Name=""兵士G""}","本当ですか？{#Name=""兵士G""}","1"
"ヤツの腹がゼロ１人を食べて満たされればな{#Name=""兵士A""}","ヤツの腹がゼロ１人を食べて満たされればな{#Name=""兵士A""}","1"
"まだ腹減ってたら……ひぃぃぃぃ！{#Name=""兵士G""}","まだ腹減ってたら……ひぃぃぃぃ！{#Name=""兵士G""}","1"
"どんなもんだ！死にに来い、ゼロ！{#Name=""兵士B""}","どんなもんだ！死にに来い、ゼロ！{#Name=""兵士B""}","1"
"あぶないぞ。あやつの目は死など恐れておらぬ{#Name=""兵士F""}","あぶないぞ。あやつの目は死など恐れておらぬ{#Name=""兵士F""}","1"
"あやつ……なんて目をしているのだ……{#Name=""兵士F""}","あやつ……なんて目をしているのだ……{#Name=""兵士F""}","1"
"じじい、ボケっとすんな！死にてぇのか！{#Name=""兵士B""}","じじい、ボケっとすんな！死にてぇのか！{#Name=""兵士B""}","1"
"ケルベロスでも止められなかったらどうすんだ？{#Name=""兵士C""}","ケルベロスでも止められなかったらどうすんだ？{#Name=""兵士C""}","1"
"そんな事考えるなっ{#Name=""兵士D""}","そんな事考えるなっ{#Name=""兵士D""}","1"
"Well, here's a piece of bad news.{#Name=""Zero""}","Well, here's a piece of bad news.{#Name=""Zero""}","1"
"A cerberus, huh? What's the plan, boss?{#Name=""Dito""}","A cerberus, huh? What's the plan, boss?{#Name=""Dito""}","1"
"The plan? I was thinking we'd kill it.{#Name=""Zero""}","The plan? I was thinking we'd kill it.{#Name=""Zero""}","1"
"Shocker.{#Name=""Dito""}","Shocker.{#Name=""Dito""}","1"
"Zero, this looks like a tough one!{LF}A real tough one!{#Name=""Mikhail""}","Zero, this looks like a tough one!{LF}A real tough one!{#Name=""Mikhail""}","1"
"I know! Stop repeating everything!{#Name=""Zero""}","I know! Stop repeating everything!{#Name=""Zero""}","1"
